ISBN,comment,uid,username
 9787801093660,"没有全部看完，感觉有点无聊。
1，一句话分成好几句来说，废话连篇
2，自欺欺人，作者对于领袖的看法:断言，传染，重复。他自己又何尝不是在书中下各种结论？重复他的观点？论述让读者相信。3，妄下结论，科学对群体没有影响，理性不存在，理性影响力小。自己却又逃避证实。
废书一本",-1,易拉罐
 9787807463726,断断续续看了20多天吧，从刚开始拿到书时的惊喜到阅读完这本书，每一本书都是一次旅行，也终于把艺术历史的空缺补上了，基础永远是根基，永远是最重要的。我们创造，学习，借鉴 不去了解那一段历史是远远不够的。确切的说这只是一本能够连贯艺术史的入门级书，那些名画 那些画家 那些故事 根本不是600多页就能讲完 但也无妨说这是一本好书，内容上充实 印刷质量也非常不错 但是那些巨作看着这小小的缩印版又怎么体会？...,-1,握不住的灵魂
 9787807463726,贡布里希早年学人类史，后来专攻艺术史，而且是个完完全全的人道主义者，超级温柔。范景中是老一辈的翻译家，很多名词不是通用翻译，要有一些艺术史的基础才可以对的上。这本书不是简单的艺术史科普，而是一种美学的教育，教人艺术的眼光和艺术的思维，读书的时候一定要思考，是一本不可多得的好书！可能唯一有些遗憾的是，贡布里希的着眼点是整个艺术史，所以给所有画家的笔墨都很均衡，而那些伟大的画家们我很希望他能多写一点。,-1,掉伞天
 9787807463726,這是我少有的讀了導論就想要打五星的書，大概是我進大學之後看過的最喜歡的一本書了。全書脈絡清晰，循循善誘，思維連貫，處處流露出一位博學多才的藝術史專家對藝術的真摯熱愛。看得直呼過癮，也感慨以前的藝術博物館幾乎都白去了。向每一位朋友推薦。,-1,十七
 9787807463726,确实如同作者所说，特别适合十五六岁的时候入门来读，不过现在读到也不算晚。印象最深刻的地方在于，关于现代绘画的起源，结构、表现和形式的分别对应人物乃是：塞尚、梵·高和高更。,-1,梅㞲
 9787807463726,一字一句认真读完，感觉获得了新生。觉得人类真是棒棒哒，有这样多了不起的人前仆后继地开拓创新，呕心沥血地磨练着自己让艺术这种观念的形式一步一步地突破旧有的疆域，有种谜之感动啊,-1,三七莲华
 9787521727333,"要想看懂西方艺术史，必先了解西方宗教史。最为历史悠久且相互对立的当属天主教和新教，而实际上新教是天主教的另一个流派，是通过宗教改革产生的。
任何一个权力绝对的机构和政权都是滋生腐败的土壤，宗教也不列外。当整个中世纪被宗教把控时，教皇的权利就是唯一至上的，所以腐败就免不了从黑暗中破土而出，令信徒困苦不堪。有压迫就有反抗，所以在北方，教皇鞭长莫及的地方，掀起了轰轰烈烈的宗教改革。",-1,有趣的灵魂
 9787521727333,十年磨一剑，严老师有心了。现在看书的人太少了，有这样一个人愿意用十年心力和阅历去创作一本这样的匠心之作，的确值得收藏，先买来收藏了。等小假期的时候再慢慢品读。,-1,可爱萌
 9787521727333,第一遍读完 深呼吸 激动哭了 如此通透！获得了对艺术的全新的视角,-1,no one
 9787521727333,对比艺术之美 感性理性之外 ,-1,果果林
 9787521727333,音乐的部分尤其精彩！,-1,金山狗
 9787541086748,惊悚、恐怖、血浆、怪兽之类的B级元素比重相当大，不过这也正应了Mondo创始人的话：Mondo的初衷就是为类型片和类型片爱好者们创作富于个性和创意的艺术海报，而且所谓“类型”大概也本就是欧美迷影文化的基石。虽然书中所列的片子一多半是我没看过的，更多只是“只闻其名、未观其片”的状态，但这丝毫不影响你去感受每张海报所蕴含的技巧、创意和热忱，真·肉眼可见的酷炫帅气。 ,-1,应用层协议
 9787541086748,RIO炸，看样书的时候literally一直起鸡皮疙瘩，数百部电影，凝结在一张张信息量爆炸的海报上，扑面而来，在大脑里不停地放烟花。实物非常美丽非常美丽非常美丽。印刷很赞，特别适合当礼物（不过你看到可能会扣留不舍得送）,-1,娘⭕⭕
 9787541086748,无话可说，真的很棒,-1,Sunnydate
 9787541086748,适合情侣在阴雨天窝在床上做完爱一起看图猜电影。,-1,小四不象
 9787541086748,美炸了！印刷效果也很好。可惜了豆瓣书店的包装，用了两片薄塑料泡沫包装。。这要是换个野鸡快递可就不止是裂了一个角，海报都挺好看，虽然我喜欢的电影在里面出现的不多。,-1,kk
 9787532739547,和《刀锋》一样，毛姆探讨了独特的个体与世俗的价值观之间的关系，他精明地运用了第一人称和第三人称的交叉，把观众与他的角色拉开一段审慎的距离，用简洁流畅的文辞，对他笔下的人物既不贬抑也不过分褒扬，使人保持在热情与冷静的中间地带，对每一种情感的描述都不至于过度夸张。他对欧洲当代风气的描述和把握可谓精准到如同一把手术刀，尤其是文化艺术圈中的种种现象，而这些敏锐的观察与思考即使拿到现代也同样受用，他出于精神...,-1,墨梓
 9787532739547,又是一本在手机上用零碎时间读完的名著~之所以打三星是因为里面对女性非常程式化和充满偏见的描写。不过这本书对于alternative life的探讨确实挺有意思，只是给你提供一种可能性，不带有任何的指导和强迫意味。,-1,Silvara澈
 9787532739547,1.为了使灵魂宁静，一个人每天要做两件他不喜欢的事。2.作者应该从写作的乐趣中，从郁积在他心头的思想的发泄中取得写书的酬报；对于其他一切都不应该介意，作品成功或失败，受到称誉或是诋毁，他都应该淡然处之。3.我看到了井然有序的幸福，但是血液里却有一种强烈的愿望，渴望一种更狂放不羁的旅途。4.我必须画画儿。5.你的意识是：如果他为了一个女人离开你，你是可以宽恕他的；如果他为了一个理想离开你，你就不能了...,-1,陆支羽
 9787532739547,与其说是小说 倒不如说是一本哲学书 【我们每个人生在世界上都是孤独的。每个人都被囚禁在一座铁塔里，只能靠一些符号同别人传达自己的思想；而这些符号并没有共同的价值，因此它们的意义是模糊的、不确定的。我们非常可怜地想把自己心中的财富传送给别人，但是他们却没有接受这些财富的能力。因此我们只能孤独地行走，尽管身体互相依傍却并不在一起，即不了解别人也不能为别人所了解。】,-1,麋鹿橙
 9787532739547,把世情掰太透。太复杂了难以言述，只能说我看得非常非常难过。就是那种每一条都和我的价值观相违背但每一条我都不乐意相信的难过。我知道我这辈子也不会成为艺术家，最多只是个艺术爱好者。,-1,三七莲华
 9787108030375,4 相见恨晚！之前想当然以为是谈美学的空话，看了才发现是扎扎实实的中国古典艺术巡礼阿！写的好大气，又不缺细节，边看边查资料，每一页都充满惊喜阿！,-1,Lyre
 9787108030375,如此挥洒自如，该有多少底气,-1,东西南北之人也
 9787108030375,艰难地翻完。往往看着看着就不知道前面讲什么,-1,HUAIHAI
 9787108030375,李泽厚最有才气的作品，与同一时期的《康德学述》和《中国近代思想史论》相比，无论从行文还是从视角，都是独一无二的。而且贯彻李泽厚个人的审美体验，以致后来许多年轻人都将此书作为模仿的对象。不过，我们现在读起来，会感觉到他受到黑格尔《美学》和钱穆《国学概论》形式的影响，也就是说他选取了中国历史上各个时期艺术形式，加以重点阐发，这与钱穆在《国学概论》中，将时代与学术思想结合的方式很接近，又突出了审美与历史...,-1,苦茶
 9787108030375,在去重庆的火车上一口气读完了。被李泽厚流畅的文字和精准的表达感染得要哭。更可能因为历史过于庞大，而不同时代的美即使不朽，也无法解决人生的有限命题。不管文学、哲学、宗教、艺术，美是“有意识的表现形式”，但更是人性的表现形式不是么。,-1,mumudancing
 9787521706994,我们这一辈子就好像一出戏，这出戏是我们自己编的，戏中谁是好人，谁是坏人，都是我们自己在决定。,-1,恩和
 9787521706994,话剧只用文字呈现，果然是一种遗憾。,-1,Massivestar
 9787521706994,花了一天时间看完了，好的剧本仿佛就是有一种魔力，让人停不住继续翻页的手。从最后一句词中抽离出来，仿佛做了一场长达一生的梦，甚至分不清哪里才是真实。相信现场观看会更震撼，只求我有生之年能抢上一张票吧。,-1,蓬山此去
 9787521706994,他把看似不相关的时空、平生阅历所睹所闻、体验与所学看似毫不费力地组合起来，战争、上海、巴黎、台北、20世纪与千禧年，流动的画幕好像自然如此，连科学家和超现实主义者牛头不对马嘴的沙龙对话在足够自由的假设下都是可能与合理的。每个人物都在寻找自己，杜象伯爵看见了鹿，江红看见了忧伤与怀旧是自己赋予的底色，五号病人穿梭于别人的故事里，旅行到尽头没能清楚病因，顾香兰是在历史的龙卷风里找自由。舞者说：“世界就是...,-1,秋霁
 9787521706994,"“浮生若梦。若梦非梦，浮生何如？如梦之梦。”频繁的场景交换，飘渺的台词创作，将一场近百年的幻梦娓娓道来。
另：想看话剧。",-1,赖怀普
 9787549586646,终于读到一本百分百适合零基础艺术史的书了（甚至比贡布里希更适合）。我在研二的时候去艺术史系交换，虽然不是零基础艺术史，但是缺乏贯以始终的艺术史思维我读得相当吃力，甚至被导师担心需不需要单独考试。说远了，只是读到这本书，发现明白作者所有的梗，知道接下来出场的是谁，原来这一年的学习终究留下了知识。本书的作者是英国泰特美术馆的媒体主管，看到这个头衔的时候瞬间明白为什么这本书会如此好读。在法国有个专业叫 ...,-1,西西
 9787549586646,作者在BBC工作，可以理解为啥写得这么有趣了,-1,河原宏
 9787549586646,开本小，易携带，翻阅方便。就是图片也小了，且数量不多。总体来说，这个价位很值了。作者不玩虚的，是个明白人，讲事情和讲道理，二者兼顾，分配的比例和难度恰到好处。非常适合大众阅读。,-1,晓林子悦
 9787549586646,图太少，又不集中，扣一分，老是要到Google Art上去查某些画,-1,jdxyw
 9787549586646,希腊室友特别讨厌现代艺术，他有次说，我给你做一个现代艺术，然后把我我的iphone盖在了他的咖啡杯上,-1,林末末
 9787521716054,做了次未署名的外编,-1,木头鞋子
 9787521716054,预售良心！,-1,光栅栏
 9787521716054,古文摘抄，真的很不用心。,-1,小白兔的鸟鸟
 9787521716054,我不算颜狗，但是迪哥是啊，我翻书他做题，在我旁边“哇哇哇”乱叫。适合全本阅读背诵，尤其是家里有孩子的，买给下一辈学一学，中国文化，博大精深，我没文化，我只会说牛逼,-1,李厂长📖
 9787521716054,期待了挺久，然而还不如《日本传统色》……没做出新花样，配的插图觉得很莫名，还要以它为核心来开发周边，那就是乱搞噱头了……别买，不值得这个价格,-1,大颗枇杷
 9787518082124,天真就是很大的残酷。泽丽是丑恶的话，奥罗拉就是美丽的黑暗。书里有很多有趣的细节（奥罗拉有很多自说自话和自我满足的言行），让人感觉奥罗拉本质上还是一个沉浸在王子梦里的女孩，看似可爱热心的表面之下，天真到残酷。只有一个地方让我感到了奥罗拉的人性，就是她看到苍蝇然后躲起来去哭的那一段——一切早都已经开始腐朽，天真的人们却视而不见。,-1,贫血玛丽
 9787518082124,画风太可爱，故事太现实。我们仿佛在看的是安吉卡特写的《借物小人》，太多女孩都以为自己是早期的迪士尼公主，最后却活成了《幽灵公主》。但里面老鼠死的真的很冤枉，让我心痛，比女主角失去男朋友和“朋友”更让我心痛。所有这一切都开始于一个小女孩的死亡这一点无比真实，如同那些每一个女孩生命中都会出现一个突然消失让人向往的“姐姐”，一个女王蜂一般的“朋友”，一个狐假虎威的“好友”，一个当他死了的“男朋友”。而当...,-1,黑貓十一
 9787518082124,不会再想读第二遍，我很喜欢这种明快可爱的画风，但呈现的内容和情节都让我感到非常不适，对昆虫更加讨厌了，虽然它们也没错。一些状貌可爱的小人实际上也是杀人犯，天真善良的欧罗拉也有她的懦弱和残忍，戴着手刃的鼠皮开始新的宁静生活吗？男的不行，自己戴上皇冠的王子更不行，虽说看到他和泽丽结果还是让我心痛了一下。死亡，血腥，活埋，蛆虫，明亮的线条和色彩一点没避讳，但我相当避讳😅 一个豆友的评论女孩童年里都会向往...,-1,江湖骗子
 9787518082124,好奇审查是怎么过的，细思极恐的阅读体验,-1,涵泳
 9787518082124,晚上到家收到，靠在床上只点着一盏台灯读完，感觉几乎有点儿被慑住无法移动。童话的外壳之下呈现的就是所谓丛林社会的残酷现实，恐怖吗，但是我们都是成年人，我们知道所有这些都可能发生，一次次地在发生，不仅仅互助友爱难以为继，甚至还要学会杀戮、吞噬，才能“不死”，但最后活下来也就因此无法双手不沾染无辜者的血，美好的童话般的梦想，只是为了麻木孤独、恐惧和负疚…… 可怕又深刻的“童话”。,-1,子文东
 9787557686727,坦白说看了你依然看不懂，本身只是在阐述一些脑科学和视觉观看上的联系，加了一些简单的艺术史，就是找了一个有点意思的切入点什么都写了一点的科普读物。,-1,Aaa…
 9787557686727,本以为“脑科学”“抽象画”是我这种普通人理解和欣赏不来的，没想到作者写得这么平易近人！！！是本很好的科普书，关于脑科学和抽象画都能学到不少知识，最关键的，确实扭转了我对抽象画的偏见！！！,-1,ayuhaha
 9787557686727,没有预期中好看，可能是有点浅；装帧很不错，当画册看还是可以的,-1,hippocampus
 9787557686727,公认透纳启发了印象派，也可以说透纳是最早简化自己同一张图案，实验了抽象主义的艺术家。印象派开始了对具象的简化。康定斯基在听勋伯格音乐会的时候，受到启发——勋伯格引入一种新的和声概念，没有中心调（古典音乐的传统是中心调），只有音色的音调的变化。康定斯基放弃了绘画中最后的具象，使用鲜亮的颜色，模糊的轮廓，《作曲5号的草图》被看作是艺术史上的第一幅抽象绘画。本书先从实验研究证明人们原本就具备欣赏抽象画的...,-1,祝羽捷
 9787557686727,"具象思维和抽象思维激活的大脑区域以及人的认知结构是不一样的，抽象艺术需要我们动用更多的外部经验、记忆、知识来做整合，所以充满了表达的可能性
“我们创造了我们自己的世界”",-1,HeliumTrois
 9787535693440,大川裕弘的摄影美到令人发抖，谷崎润一郎写作不分段。中文版的开本和排版都不错，但是用的纸太硬，加上胶订导致书掰不开，这种“刚强”感与本书图文营造的“阴柔”错位了。,-1,私享史
 9787535693440,丧性日本摄影书,-1,嗯嗯老人
 9787535693440,“让空无一物之处滋生阴翳，再从中创造美”,-1,杜扬Seatory
 9787535693440,开本大小非常适合随身携带，文字与摄影相结合，能更直观地感受日式美学。,-1,darkcat
 9787535693440,昨晚借着酒，达成了“读完最后一行，观至最后一张”，以及“酌尽最后一觞”的夙愿。感觉谷崎润一郎在散文里很内敛，常常见他越写越露骨，眼看就要“原形毕露”时，笔头忽然打住，折回原来的意境，继续风雅起来。而关于“阴翳”的主题，本书的摄影作品应该说较好完成了配合文字的使命，但比起文字仍然是逊色的。这主要是因为，阴翳作为一种审美情感，需要的乃是我们眼睛的真实关照，那种暗淡的侘寂里，还需要有流动的性格，有些微妙...,-1,danyboy
 9787535680174,妈的居然贬值这么凶？当初看罗振宇吹这个，好像花了我2k大洋。货确实是好货，适合收藏（狗逼罗振宇）。因为贬值太厉害气不过，怒减一星。,-1,都切边边上耍
 9787535680174,买之前并不知道这是一本4开大的书，我妈非说有二十多斤，称了一下，16.1斤。内容一样很重。关于印刷，油画色彩的还原度肯定比不上原作，但是书中各国很多雕塑或是精美的工艺美术作品都是平常不容易看到的，而且后面收纳了很多现代艺术家，除了空间艺术以外还有摄影作品。所以真的是很值的书，因为于我来说有机会出国去美术馆的可能性比较小……,-1,第七颗煎蛋
 9787535680174,尺寸可以稍微再大一点#价格就。。。#,-1,GTM
 9787535680174,真是太紧张，太刺激了,-1,大飞艮
 9787535680174,文字脉络太弱 分类落后五十年 这方面失望极大。成品不配雄心 最好能有个当代观点的补遗。至于想要尽可能兼容覆盖又无法无限篇幅 选品随机或重复也就不便苛求了。西欧中心也是意料之中 意大利部分很棒。  给小学生看也只能算补充读物 需要对照其他读物阅读。限于时空 飞不去看实物 作为入门通识 填补一些空缺 好歹聊胜于无,-1,bee
 9787307219205,欣赏音乐是一种艰难的快乐。,-1,玄子
 9787307219205,一口气读了几十页，很有趣，不枯燥，比专业书好读很多。,-1,Miffy
 9787307219205,贝多芬从来都不知道自己写过一首曲子叫“命运”？如何正确看待所谓的音乐抄袭？为什么好音乐却不“好听”？作者深入浅出地梳理清楚了很多基本概念，破除误解，解答困惑。 内容不艰深，写得很认真，值得所有音乐爱好者都读一读。,-1,Rispetto
 9787307219205,面向入门者的诚恳之书，有理有据，有料有味。,-1,海舟
 9787307219205,看标题答案呼之欲出，因为没学乐理啊。所以到底为什么要写那么长，抱着这样的疑问阅读了本书，被作者流畅的逻辑论证和非凡的文笔水平折服了。像作曲家在简单短小的动机上看到潜质，作者把一个小小的疑问写成了雄辩的篇章。,-1,阿阿阿阿阿潘
 9787535688804,这本书从19世纪中叶，大家耳熟能详的艺术品的故事讲起，一直说到了当代艺术的最新成果，这个断代的范围其实是非常有价值的。我们不能总是停留在古典的辉煌，或者只满足对于塞尚、梵高、穆夏、毕加索、罗斯科、安迪沃霍、弗里达等少数几位大师的津津乐道中，而忽视了整个艺术史无数同样精彩、重要，给人启迪与享受的作品的存在。这本书的出现正逢其时。在我看来，尤其是学习美术，学习画画的同学们，了解这些历史，实在是当务之急...,-1,李洋画梦
 9787535688804,终于再版了！！86那本已经翻掉页了┐（─__─）┌,-1,星野
 9787535688804,很全，很重，适合入门,-1,李唐
 9787535688804,绘画摄影雕塑装置等超多图各种现代艺术形式，文字译笔精到凝炼，总结了诸多大师级作品的思想溯源，创造与完成思路。一直作为美国高校现代艺术史首选教材。也是部现代艺术涵盖全书，入门还能走两步的精到典藏级。最后还有附录~术语表（业界专用术语注释），索引（包括艺术家姓名，艺术作品，艺术杂志，艺术组织，主义，流派等）。明线资料浓缩在前，术语表和索引都是隐线资料在后。自初版以来没停下精修功夫，至此已经六版，严谨坚...,-1,珍妮的肖像
 9787535688804,我浪艺术史TOP3的重量级大作！国内首度正版、足本引进，80万字译稿精心打磨近10年！看当代艺术展看不懂？真· 一本书带你读懂现代艺术~,-1,艺饭
 9787550263802,这里面的书信大约仅涵盖了艺术的部分，最后梵高自杀时没发出去的信里面谈到的生活困窘几乎在这些信里只字未提。梵高说，不要可怜他，他在艺术中找到了自己的价值和纯粹的欢乐，这种喜悦可能很多人一生也不曾得到过。几次几乎泫然泪下，他只是简单地爱着自然、生活和普通的人们，在线条和色彩中寻求永恒。,-1,蓝色田野
 9787550263802,麻蛋看哭。观看艺术最好的方式、对创作最深的敬畏永远来自观看艺术家本身，而不是100个他者的解析。看着他每封信都充满对画画的热情，对周遭事物高亢的感知力，对勤奋这件事的深信不疑，对人生选择的义无反顾。真的是燃烧生命在画画，灼伤了我的眼。,-1,糯木
 9787550263802,看到流泪,-1,素素
 9787550263802,Vincent在信里说，喜欢广袤的平原，一无所有，但却无限永恒，有生命栖息。他带着善意，希望自己可以画出如灰尘覆盖的微草般的人物，笔下的农民可以看起来像用耕种的土画得一样。他想要表达纯真的人性，敬畏超越人类更伟大的存在，大多人都觉得他是天才，但他却懂得，即使天生懂得很多东西，也要付出至少三倍的努力，才能从本能的发挥到达理性的创造。脑中挥之不去柠黄钴蓝和莺尾紫，以前以为自己最爱星夜，看完才发现忘不了...,-1,会小楠
 9787550263802,如果真有上帝，你为何给了一个人才华与发疯的热情又不给他希望呢？梵高名气大到别人都一点都不了解他。从他都信件里能看到他就是一个标准的爱艺术胜过爱一切的积极文艺青年，可惜10年的穷困彻底的毁灭了一个人。另外不能不说他的弟弟提奧也非常了不起。,-1,雕刻时光KL
 9787209041065,算不上是设计入门，不如说是设计/信息传达的普及知识。更多地，这是提供一种方法论，代替不了个人认知水平和审美水平。功夫在场外,-1,小刀周遠
 9787209041065,设计不是一种技能，而是捕捉事物本质的感觉能力和洞察能力。,-1,森先生
 9787209041065,原研哉和田中一光对设计的态度都充满来源于生活的自省和细致的观察力，感受力。从很多角度去看待一件事物的做法值得学习，最重要的是……两位大师一直坚持的谦逊自然的心态=-=,-1,李骨一
 9787209041065,一个好设计师和一个平庸设计师中间差了一个哲学家。,-1,彭萦
 9787209041065,原研哉的设计很好，书中的案例不错，但原研哉讲东西却含浑无物。,-1,玉常｜象数演义
 9787549530816,由于大家熟知的缘故，本书各处，奉命删节，谨此告白——陈丹青《小引》。。。,-1,nothing传叔
 9787549530816,老奸巨猾。。。。年轻有点文化基础，坚持到老年，基本上都能说出木心的话,-1,阅微草堂
 9787549530816,木心，有学识，无脑，无才。且三者唯有学识，可靠后天积累。大量的同语反复，提到的书，我相信大多只是翻过，说读，读完，不可信。多给一星，因书中某些句子实在精辟，是否真是木心所思所想而所得，不可考。,-1,sin
 9787549530816,我喜欢木心掷地有声的结论。最近看来的一段话可以描述这本书：「好书最伟大、最奇妙的特点之一便在于，对作者可称之为“结论”的，对读者则是一种“激励”。我们强烈地感到，我们的智慧始于作者的智慧中止之处，我们希望他给我们答案，而他所能给的却只有欲望而已。这种“欲望”是什么呢？就是探寻之欲，就是要让自己已被点燃的思想继续烧下去，所以好书不是别的，不过是药捻儿，药引子，是给我们“开始”而不是“终结”的东西，是...,-1,[ e c h o ]
 9787549530816,初读，惊艳，之前已惊为天人。后来怀疑，不过是漂亮聪明的金句，书读多了，讨了个众人的巧；读完，这文学长征叫人佩服。先生到底是人，优点缺点都在这本书里，很可爱。最后，被先生领进门，感激。有些观点想法被印证，像隔空相聊甚欢，尽兴,-1,Mignon
 9787563349890,保持轻松而有距离的态度，只为美之为美。“慢慢走，欣赏啊！”,-1,Siyi
