ISBN,comment,uid,username
 9787557023362,"
这似乎是我第一次看以色列的漫画，但完全没有任何隔阂，因为全世界中年男人的生活状况都差不多：为了家里的一地鸡毛焦头烂额———但也不乏和家人一起度过的温馨浪漫的珍贵时光。好在有漫画，喘不过气来的时候还能靠想象力短暂抽离，从现实瞬间移动到超现实，化身超人拯救自己。从前往后也能看出作者画功的明显进步，对结构了然于心之后的下笔如有神，画面更加养眼舒适~
二〇二一年第二本*年度十佳图像小说*预定一个席位！",-1,维城乱马
 9787559612168,#需重读# 将眼光放长远，根据每个阶段的侧重点规划职业发展路径，培养技能点和network，在这个急功近利和贩卖焦虑的年代真是股清流,-1,D
 9787559612168,18_1 一般般 讲的都是普世的道理 唯一令人欣慰的是看到人80％以上的财富都是40岁以后获得的,-1,Blanket
 9787559612168,凛冬已至，想当活下来的那一个，跑得久的那一个。,-1,shininglove
 9787559612168,不愧是公关公司出来的，很会包装炒作，而且没几页干粮还卖这么贵。。。全书内容完全可以提炼成1000字发布在职业规划微信公共号上。,-1,The Invisible
 9787559612168,进入职场近4年，最多计划和憧憬过未来5年。这本书让我看的更远，重新认识职业生涯，3大阶段，45年，很受启发,-1,枫零俊
 9787115552280,"一本干货满满，让你停不下来的书。
",-1,少年游
 9787115552280,这是一本讲如何用ppt演讲的书。重点是演讲，要有逻辑，有结构，还要会用技巧，运用幽默，讲好故事，同时还能应对演讲中出现的各种意外等。演讲是个综合能力，不断练习，有了技巧还需要练习变成了自己拿手可用的才行。,-1,子非鱼
 9787115552280,看完书，发现了一个好的“输入渠道”—淘宝网。推荐理由是，剁手前看看是哪个广告设计、哪句文案打动了你，能打动你的也能打动其他人。,-1,肉褚
 9787115552280,学术报告、年终汇报、求职应聘、融资演说……越来越多的场合需要用到PPT演讲，如何呈现一场精彩的PPT演讲，已经成为职场人的必修课之一，通过《PPT演讲力》的阅读，相信我们都会对PPT演讲有新的体会与认识。,-1,言西早谭
 9787115552280,power point ，一本你会一口气读完的书，一本你读每一句话，都觉得充满着力量的书~,-1,winne妈爱阅读
 9787210093213,好的方法是可以学习和训练的，好的思维方式是可以借鉴和培养的。开卷有益。,-1,Ada
 9787210093213,有人靠身份逆袭，有人靠天分逆袭，如果你什么都没有，只能靠深度了。深度的生活才是优质的生活。,-1,迪迪
 9787210093213,只有我觉得是bull shit 嘛？,-1,我叫卢大胆
 9787210093213,真没必要写成一本书,-1,蓝石头
 9787210093213,理论一套一套的，实践指导基本都是屁话。#成功学免疫#,-1,琼斯黄
 9787559647184,我是那种一到下班点马上会拿着包第一个冲出公司的人 所以共鸣感不是太强 我太会耍废了 工作让我痛苦的话我会直接炒老板鱿鱼 不过周围的朋友们经常和我抱怨他们的工作 无论是上司刁难还是工作时长惊人 可他们因为种种原因就是无法辞职 真应该让他们都来看看这本书 人生嘛 活的开心 活的自由 最重要,-1,塔塔
 9787559647184,社畜自救手册，看一看笑一笑。,-1,顾安夏
 9787559647184,2019年，看到朋友每天加班要死掉，心血来潮想起做这本书，希望她早日辞职，脱离苦海。没想到，不久后我自己就辞了，这书就留在前司，直到刚刚前司姐妹问到本书的缘起。我想说的是，虽然生活很“痛”，好在你可以自己选择过得多“苦”。潇洒一些，当辞则辞。我那个朋友后来辞职回了老家，现在过得很好。祝新书大卖！,-1,米开朗直子
 9787559647184,“抑郁症的表现之一，就是认为自己的工作非常重要”,-1,张豆豆
 9787559647184,"买这本书之前就已经和直属领导提出离职申请了，那是建立在痛苦三个月，恍惚两周，痛哭五个小时的基础上作出的决定
自己能够感受到身体与精神亮起了红灯，不仅仅是自杀的念头总是萦绕在脑海，甚至动了买药物的想法，但思来想去为了工作自杀根本不值（更何况这公司好多人都智障本障，…
虽然离职看似是解脱，但实际上焦虑并不会消失，我亲身测验过，有工作时会被繁杂的事物压死，不工作时又会困顿于生存的压力，唯一能想到解脱的方...",-1,人间失格
 9787561327210,讲厚黑学的玩意，有太多这样的中国人，只讲做人，就是不讲做事。,-1,yuan
 9787561327210,才看了10页就决定买实体书，这本书以后一定要放在书桌上，日日研读，推荐给每一个工作两三年的职场新人，乘你还没有彻底变成蠢驴前，赶紧收起你那洋洋得意的驴耳朵认清现实吧,-1,Oceannagirl
 9787561327210,此书极度牛逼，很仰慕作者能有如此见识和文笔写出这本书。怪不知道豆瓣评分如此之高。不过，这书不太适合初入社会的新人读，我花了好几天才从描述中的职场政治的阴霾中走出来....,-1,Hammer_
 9787561327210,前些年特别火的一本书，买了好多年都没看，收拾东西翻出来就把它看完了，我这个行业没那么多规矩，同事也没那么多说法，但是不妨碍这本书还是挺有意思挺通透的，有些事儿你未必遇得到，但是不能不知道。,-1,冒菜王
 9787561327210,听君一席话，省读十年书,-1,逛逛
 9787513933681,你有没有遇到过这样的情况，给客户、朋友、领导反馈一些意见时，对方很不耐烦 甚至发脾气，摔手而去，留下尴尬的自己？为什么明明为对方着想却引起对方的反感？《反馈的力量》一书告诉我们，这是因为没有和对方通过有效沟通去建立信任感。所以下一步得和对方进行有效的沟通，首先要学会欣赏和赞美对方，让对方放松心情，放下戒备心，尽量找些对方感兴趣的话题，通过融洽的聊天氛围建立信任感，从聊天中了解对方的需求点，当有了共...,-1,红尘若梦
 9787513933681,很实用,-1,sanchun
 9787513933681,简直就是职场干货,-1,小邋遢
 9787513933681,第一次读，感觉不是很顺畅，语言有些啰嗦,-1,天空下的小虎哥
 9787513933681,书中提到作者本人正是因为一个同事某次随意提到她目前这种热情洋溢的状态非常有感染力而成立了事务所，几年之后成立了人本管理有限公司，这件事让我感触很深。就是这样一句不经意的话，一个小小的肯定，对她产生了莫大的影响。由此可见，反馈的力量多么强大。,-1,花花
 9787544276986,基本是耐着性子读完扭曲的家庭回忆部分，书名educated，但恰恰接受真正教育的着墨少之又少，那些真正的震撼、真正的自省、真正的成长，我不知道作者是认为乏善可陈还是有所隐瞒，我同样惊讶于在十年学业生活中遇到的人全部面目模糊，可能对于作者来说建立一种新的亲密关系颇为困难。中国语境下，这本书给我的触动远没有预想的大，因为中国有太多扭曲的原生家庭，给人带来终生的心理创伤，恐怕更甚。,-1,Deborah
 9787544276986,单纯从书的层面来讲，远远被高估了。,-1,火心
 9787544276986,只有当你成为自己时，才会摆脱来自他人的地狱。,-1,七月
 9787544276986,好像回到读《我的天才女友》的时候。进入得慢，读起来兴奋甚至战栗，读完心情不能平静。,-1,桃花石上书生
 9787544276986,故事太令人震惊了。在这样家庭长大的孩子竟然有三个取得了博士学位，实属不易。,-1,冬惊
 9787544722766,“有些黑人撒谎，有些黑人不道德，有些黑人在女人面前不规矩——不管她们是黑种女人还是白种女人。但是，这种真相适用于人类所有的种族，而不仅仅是某个特殊的种族。在这个法庭里的人，没有人没撒过谎，没有人没做过不道德的事，没有一个男人会看女人时从来不带欲望。” ,-1,百憂小姐
 9787544722766, 我喜欢这本书的结尾部分，文字很美。这个故事不仅仅关乎父爱，还关乎平等和民主，关乎人类的文明与进步。阿蒂克斯是个先进于时代的人，所以他的孩子一定不会泯然众人。怪人阿瑟是世俗意义上的怪人，可其实他那样温暖。梅科姆镇上的大多数人都平凡又善良，莫迪小姐在茶会上紧紧握住斯库特的手，泰勒法官尽可能引导陪审团做出正确的判断，赫克警官是保有正义心的警察。怪人阿瑟留在树洞里的香皂娃娃不走的怀表和表链是他对孩子们最...,-1,Cenderella。
 9787544722766,直男癌你们尽可以喷，但是要记住，喷直男则是一种罪过，因为他们不物化女性，不伤害女性，他们只是用心履行社会强加给男人的职责。,-1,cys.tony
 9787544722766,“你好，怪人。”,-1,Jane、
 9787544722766,心智正常的人从不会持才而傲。,-1,颜先生
 9787544222976,“教育更多不应该是为受教育者找答案，而是给他们找自己答案的勇气与能力。” 这句话说得多好呀。所以，校长在看到小彻子挖粪池、捞钱包的时候，没有去阻止她的，校长不用成人世界的条条框框和精致规矩做一只笼子把小彻子“关”起来。一个不墨守成规、耐心聆听孩子需求、有创造力的老师，令巴学园如此不同。大家努力，让世界上有更多这样的幼稚园和学校吧！,-1,E
 9787544222976,记得读这本书时，是二年级时的小学图书馆,-1,甯
 9787544222976,比什么哈佛女孩刘X婷之类的强多了,-1,寂多蔓生
 9787544222976,很有趣又很感人的书。“小豆豆感到生平第一次遇到了自己真正喜欢的人！因为，从小豆豆出生后直到现在，还从来没有一个人这么长时间听她说话呢。”,-1,赫克托尔
 9787544222976,适合所有觉得童年被辜负的人。,-1,迷踪
 9787544766500,【2017.49】有人的地方就有偏见，然而啊，亲爱的孩子，心存善念，坚持正义让你活得更有教养，更有尊严，更问心无愧。,-1,狷介有乌青
 9787544766500,你好，怪人。,-1,布鲁伯德
 9787544766500,好想嫁给阿迪克斯。,-1,清梓笺。
 9787544766500,你永远不可能真正了解一个人，除非你钻进他的皮囊像他一样四处行走。,-1,非虚构
 9787544766500,希望我以后也能成为这样的父亲，在维护社会正义的大事上做不到，在对待孩子上希望能做到。,-1,海扬尘
 9787544243889,http://book.douban.com/review/1091978/    这位笔记归纳不错，省下做笔记的功夫了。,-1,noname
 9787544243889,好书，将来给自己孩子看,-1,一坨猫球
 9787544243889,"本书教的不只是投资，更重要的是如何扩展个人能力的疆域。
书中这句话最精彩：“当你把精力集中在你知道、能做和拥有的那一天起，你的成功就已经来开了序幕。因为大多数人都把一声的时间都用来考虑他们不知道、不能做和没有的东西上。”",-1,安静并不安着
 9787544243889,去年双十一买了小狗吸尘器，送了本小狗钱钱，今年看完了,-1,李草木
 9787544243889,看一本理财书突然间会哭，很好奇是不是还有别人和我一样，“不要为失去的东西而忧伤，而要对拥有它的时光心存感激。” 用这样的方式去收尾对于理财而言真的好吗？一本给孩子的书，对一个缺少财商教育的老大爷来说也是有用的，可融入宠物角色的情感和互动并以这样的方式去收尾可是有些措手不及了。能感受到的太多，我们需要的其实并不是钱，有了钱可以让你更珍惜，也可以让你沉迷声色，对于一个想在人生后半场活出真正自由的人来说...,-1,PaulWFilm
 9787544280020,人生不能重来，可是我也真的好想在小时候有这样一个引路人,-1,时光易逝
 9787544280020,一本简单、温柔、明朗、且时刻提醒我不忘初心的书。,-1,奕笙
 9787544280020,全书共十个章节，从阴冷滞重的冬日到万物苏醒的春天，恰好契合少年从自我迷惘向清醒认识自己与世界的转变。每个章节都以寻常事件打底，重点在于篇末舅舅写给少年的笔记或信件，这是作者力图向读者阐述的世界观与价值观，所涉及的范畴极广，从天体运动到人文艺术，从经济策略到人际关系，从历史人物到佛陀由来，细品这些丰富的知识信息和深邃的内在原理，何止是让青少年们受益，阅历甚众的成人亦不妨一读，从中或许可照见曾一度失落...,-1,欢乐分裂
 9787544280020,活出怎样的人生 大概是一生的课题 小哥白尼是幸运又聪慧的 有引导者 有小伙伴 有温和的母亲 成为一个真正的好人 是如秋日阳光一般温暖的存在呀 ,-1,Pikaichi
 9787544280020,书没问题，是自己有问题，在这个年纪读所谓的励志文学完全没有感觉，如果年轻个十岁，我想就算不看得热血沸腾，至少也醍醐灌顶，如获珍宝。就像书名一样《你想活出怎样的人生》，这个问题的主语是“你”，当然只有你自己才能知道，这样这本书就失去了最大的意义，对我来说，有这时间还不如读一本引人入胜的小说来得畅快。,-1,august
 9787569918816,父母一辈子都在等孩子说谢谢，孩子一辈子都在等父母说对不起。,-1,子书夜寐
 9787569918816,不指望一本书能拯救什么，但有一些启示，有一些帮助。,-1,carening
 9787569918816,这本书里举的例子振聋发聩，对很多人来说，首先要认识原生家庭对自己的影响，才能运用一些方法从原生家庭的负面影响中走出来，恢复自信，找到自由，成为一个全新的自己~,-1,弘丹
 9787569918816,非辩护性回应  直面父母   获胜的唯一办法就是退出游戏,-1,养生少女
 9787569918816,意识到自己性格缺陷跟父母有关，并不是要去一味责怪父母。而是要放下自己的心理袱，和自己内心的小孩和解。从负面影响中解脱，成为全新而独立的自己。,-1,帽帽的小宣园
 9787521719253,大部分优秀的心理学科普书籍都不可避免地陷入了一个怪圈：真正需要读它的人，往往是最不愿意读的。,-1,Ray
 9787521719253,需要反复翻阅朗读背诵重复练习直到改变为止系列。感谢书中传递出来的“这不怪你”“你不是一个人”“你能够变好”的信息。讲真，这本书不止是一本育儿书籍，更是对成人干涸内心的一场疗愈之旅，我想这也正是我和评论区的小姐姐都会在这些朴实无华的文字中哭得稀里哗啦的原因。以尊重（双方）为前提，倾听（而不是管教）对方，表达（而不是掩饰或宣泄）自己，学会用“我陈述句”取代“你陈述句”，这是我在书中学到的最核心、最本质...,-1,风吹草痒
 9787521719253,太有用了 任何亲密关系都适用,-1,Molssi
 9787521719253,又是一本要推荐给列表里所有人看的书！读起来轻松又可以学到非常多东西。,-1,无忧教主
 9787521719253,简单来说，就是把小伙当人看。但问题是，现在人吧，大部分时间把成年人都不当人看。,-1,夸梅@勒布朗
 9787534396533,好书，让我又意识到自己对教育的存在的认知偏见。以后再也不敢对类似问题大放阙词。,-1,四四四毛
 9787534396533,阳志平http://www.douban.com/note/267359148/。学学人家如何通俗易懂地普及认知心理学写作。一环扣一环，逻辑超清晰，写得真好，结语作者道出了真相。周末写书评。通过本书悟得一道：笔记、书评永远最好只是思考的副产品。总觉得“无他，但手熟尔”“积累”之类的大词不解渴，这本书终于解了我的渴，将这类大词内含的原理剖析清楚。ps内向有个用得到的地方,-1,Kuhn
 9787534396533,1大脑并不是用来思考的，它的真正作用是使你避免思考。（懒是本能）2人们在解决问题时倾向于用记忆（经验）而非思考。3对待课业要把它们看成一系列答案。备课时，从你希望学生掌握的知识入手，考虑如何提出问题。4作业要分层。5坚持记教学日记。6记忆是思考的残留物。7教师的目标是让学生思考意义。8让课堂充满故事性（因果，冲突，多样，角色）。9孩子的智能差异可以通过持久的努力改变。10赞扬努力，而非能力。11只...,-1,不勒个二
 9787534396533,力荐。对人脑认知原理和教学启示的阐释非常务实，连贯妥帖，直中要害。刷新了不少意料之外情理之中的认识。推荐给对学习理论、脑科学以及教学原理有需要和兴趣的人，适合“知其然”还要“知其所以然”的人。“如果我们不能将人类积累的智慧用在教育孩子的方法上就太可惜了，这就是本书出版的目的。教育应该使人变得更聪明，聪明的人让世界更美好。”,-1,[已注销]
 9787534396533,2015年11月28日读毕，主要收获是：（1）这本书所蕴含的思考机制对于认识学习非常有价值。这种思考机制是环境、长期记忆（事实性知识、过程性知识）和工作记忆（意识与思考）之间的关系，思考是在工作记忆中产生的，良好的思考需要一定背景知识，同时也具有通过专精训练形成的自动化的内隐知识。（2）思考并不容易，其在日常生活中的作用要小于记忆的作用，思考对于推进知识的扩展，也就是创造具有意义。（3）事实性知识...,-1,左思
 9787208130500,年底读的一本书。斯通纳是个活得很明白的人，对工作是，爱情也是。明白，源自于对于生活的发现与认真，源自于对事实的承认以及恰如其分的自省。他意识到自己的无能为力，意识到自己没有选择的选择，意识到婚姻的失败。……而明白地活着有时候并不如意，就像道理都懂，可它改变不了什么。他没有改变生活，他只是选择生活，与之共处，然后，物我相忘。,-1,耶桑
 9787208130500,有些人的一生真的挺无聊的,-1,久遠
 9787208130500,感觉是把各种典型糅合起来的超典型人物 没有任何意外或惊喜 不理解为什么那么多评论说什么“斯通纳是真正活过” 反正我是做不到事事不顺 然后沉浸在学术里 就好像可以弥补一切一样 其实就是个人选择而已 还是懦弱的人的选择 并不是指责这种处事方式和态度 但完全没有必要这么万人传颂的架势... 那么多人有共鸣是因为即便如此懦弱平凡也可以被写成书得到认可么 还是说羡慕这种甘于平凡的心态 反正对我来说 没有尽自...,-1,塞得内斯
 9787208130500,翻译有点儿不顺畅，但小说内容让人感慨，大学好像100年没有什么变化。,-1,叶扬 | 独眼
 9787208130500,值得五星推荐。知识分子的形象并不易写，毕竟他们总是与自己为敌,-1,维舟
 9787301270936,今年读到的最优秀的社会学\人类学专著，扎实，正统，专业，样本选择合理，案例记录详细，同时又具备语言上的生动。尽管基本清楚自己受的是中产阶级教育，但在读本书之前，我并没有想过中产阶级在儿童教养方面有如此一致的行动模式，也诚如书中的中产家庭子女一样，我很难主动感知到阶级资源优势在我的成长中起到了什么样的作用。阶级的存在太过真实，以至于人们会刻意忽略它，而这本著作结论令人伤感的原因之一就在于它击碎了“个...,-1,盐少女
 9787301270936,"可以说是本小镇做题家的人生之书。我的父母和第十章中描述的父母基本无差，每日精疲力竭地奔波于“赚更多的钱”，所以不得不把所有的教育责任托付给学校、补习机构和培训机构等等。他们对孩子的要求相当简单，无非是“健康、快乐、真诚”等朴素的美德，只是他们显然更希望有一个“成绩好”“不给他们丢面子”的孩子。
“在子代教育方面，中产阶级父母在资本投入上有显著优势，但在家庭教养态度惯习上却和底层阶级的父母无甚差别。...",-1,思荔
 9787301270936,很多时候我们还是要对自己抱有同情之心，差距并非都是个人原因。,-1,山上的小华
 9787301270936,六月打卡。1.新版，新增第四部分《不平等的童年与不平等的成年》，有从10岁开始到成年的生活轨迹。想起《人生七年》2.孩子们是在宽泛而分层的社会系统里长大，协作培养与成就自然成长各有利弊。3.中产阶级、工人阶级、贫困阶级，似乎少了富人阶级，还是没必要？4.家庭生活和社会背景的影响强大而持久，10岁时，中产孩子显得老练、世故、难以感动，工人和贫困家庭孩子看起来显得年龄更小、更活泼、更童真，而十年之后，...,-1,Karl
 9787301270936,"这本书就是要做这样一个自问自答尝试，影响一个孩子今后生活质量的因素有哪些？它给的答案分布在孩子和家长、社区、学校及周边信息刺激关系等，以及他们出身就不可磨灭的阶级和种族印象。其实不用作者调查凭直觉就能想明白，难道村里老王的儿子，能和赵省长的女儿在一个水平上竞争吗？难道他们父母各自携带的社会关系不会作用在其子女身上助力吗？这就是人人生而不平等的社会现实，无非是因为美国早期没有封建社会关系约束，能...",-1,吉吉范特西
 9787510842252,不好意思我就是要打差评，通篇的学究气息，清高地令人尴尬。作者只看到了大学生成为优秀的绵羊，却看不到这种选择背后的无奈，作为一个象牙塔里的教授，我觉得作者没有这样的资格去评价。,-1,面壁者2108号
 9787510842252,大约是在这个功利实用的社会里最能引起共鸣的一类书。高度统一的价值观和职业选择，谨小慎微不敢犯错不敢坚持自我，一味追求表面的优秀而忽略内心的丰盛，以“居高临下”的姿态去施舍同情而不是尊重公正。精致的利己主义者和常春藤的绵羊，在中美两种社会下惊人的相似。身边的好多人，甚至自己都不自觉地落入书里所提及的好多现象里。已经经历过两国的所谓精英教育，而当下最大的take away大概是在生涯的选择和做公益的态...,-1,rollaround
 9787510842252,吐槽文，而且过于偏激了。,-1,[已注销]
 9787510842252,说实话，这教授还好意思做教授？写得散文不散文，学术不学术，思想不思想。居然还引用n多小说来证明自己的观点。四个章节没有头绪，主要的论点颠三倒四地重复，毫无建设性的指导。我真是服了。他文字说一人的书名就应该获奖，但他这本书，读者只需要读书名就完全够了。,-1,a la de la
 9787510842252,"二十多岁是""带着问号生活的十年""",-1,口吃老佛爷
 9787100040945,"在进行了漫长的""分析阅读""之后，我觉得本书其实只需要""检视阅读""一下就足矣了。啰嗦是一种病。",-1,马什么梅？
 9787100040945,冲着高分评价买来看，结果有逻辑无趣味。要让一本工具书有趣味似乎强人所难，但了一半就更坚定了我自己的观点：阅读应该随心，别让条条框框束缚你，没有乐趣的阅读特别没劲，最好的阅读方法就是打开一本书看十分钟，能继续就继续，不能就扔一边。不建议其他人看这本书。,-1,aaron
 9787100040945,翻译的有点儿烂,-1,小薛
 9787100040945,明明是如何做阅读理解啊。。。。。觉得这本书这么有用的人。。。是有多么不会读书。,-1,柴犬妹妹
 9787100040945,伟大的书，每一个爱读书的人都应该尽可能早的去读这本书，这样你可以少走很多弯路。我从这本书中获得最多的是“速读”技能，让我震撼的是“这本书跟你有什么关系”这个问题，这让我避免了很多无效的阅读，节省了大把的时间。,-1,我的剑会笑
 9787505746886,读起来很容易；叙事感很亲切。好像有个朋友刚好是家庭教师，刚好约了下午茶，随便聊聊天，就谈起这些事。可能是个秋天，气温快要降下来，但太阳透过玻璃照在身上，又还算暖和。所以心底不至于特别凉，也没有特别被震动。   目前读到的几个故事，即便没有亲眼见到过，也想象得出来。非常合乎逻辑，太好理解了，就在身边发生着。但是你完全没办法指摘。因为是别人家的小孩，也因为自己也一样不太懂怎么教小孩。    有点无奈，...,-1,𝛁
 9787505746886,字里行间还是“吃人的父权社会”。,-1,唐小万
