ISBN,comment,uid,username
 9787559649751,感觉读完不像小说，更像作者的大学年轻时光的回忆录，看了一下果然作者高材生，毕业于四川大学历史系，果然怎么感觉如此枯燥乏味的大学生活居然被写的如此文邹邹，果然80年代高材生！全文大概一部分是作者自己的回忆录吧，另一部分讲述了自己室友老王和人约架，被人暴揍一顿后，美国女朋友被拐跑的悲剧故事，😂果然我们不是很懂那个80年代大学生，他们的爱好除了吹🐂🍺就是找人约架，泡男女朋友，看电影少林寺。从文笔也能看出...,-1,Leonkenndy
 9787559649751,更像《神秘的大佛》和《少林寺》引发的青春同人文。它甚至没有1980年代常见的恋曲或者爱情，只是打拳争勇，愣是看出来个巴蜀徐皓峰的意思了（但没有女人引发的荷尔蒙又太不像了撒）。植入大慈寺、鹤鸣茶社之类的元素，就跟拿泉州南少林说事一样标签🏷,-1,木卫二
 9787806070697,古龙唯一比金庸好的点大概是人物思想的前卫和现代化，中二文风不提，人设和情节越写越崩。而且感觉上从对写作的态度来看古龙就没金庸严谨认真，七个故事一个比一个糊弄，后两个干脆找别人代笔，真是混一天酒钱算一天的水平。,-1,三鲜伊面
 9787806070697,三星半。四条眉毛可以有，两个酒窝不能有。PS：银钩赌坊一章严重拖累总评分。每个女人都不当影后会shi。,-1,陶者无缰
 9787806070697,三星半,-1,释凡
 9787806070697,峰回路转的思路很棒，可是古龙大爷写的实在是太绕了。。。,-1,于老板helio
 9787806070697,花了几天时间读完了，可是我还是对陆小凤和西门吹雪喜欢不起来。印象最深的是花满楼和他的名句：“你有没有听见过雪花飘落在屋顶上的声音？你能不能感觉到花蕾在春风里慢慢开放时那种美妙的生命力？你知不知道秋风中常常都带着种从远山上传过来的木叶清香？……” ,-1,小小
 9787121139512,生在这个时代最大的幸运就是可以看到商业和科学技术完美结合不断的改变这个世界的面貌，不断的改变我们的生活方式。   吴军博士不断的说能赶上科技发展的浪潮便不枉此生，每次读到这，心里都很不受用。,-1,[已注销]
 9787121139512,很棒的了解IT领域的入门读物，全面且逻辑清晰。以IT界的科技变革为基础，到产业组织以及与资本的博弈，深刻而全面。,-1,熊大茸
 9787121139512,厌恶华尔街，喜欢斯坦福,-1,风撼斜阳
 9787121139512,写得很差，完全不建议阅读。,-1,师北宸
 9787121139512,#恒阅# 这本书给人最大的启发就是：一个企业能不能活可能是靠自己，但是死不死真的是靠命啊……什么企业基因论，不就是宿命吗？另外，作为一本介绍行业历史的书，如果一定要总结出一些规律，就必须做更深入严谨的研究，否则就可能出现本书的问题：同样的逻辑用在不同的企业案例上会出现矛盾……,-1,一默
 9787121106101,我很讨厌充满比喻的各类入门书籍，好像科普必须借助于更低级的美学系统才能证明自身。所以这本书我很喜欢，作者对计算机原理偏执的爱，打通了后者通往文科生的道路。,-1,[已注销]
 9787121106101,图表质量令人发中指。,-1,大嘴巴灵机一动
 9787121106101,写给初中生的计算机科普书,-1,飞林沙
 9787121106101,如果搞IT的是一个单一种族的话，这个种族的小孩读的童话书就会是这个样子,-1,thrash & blues
 9787121106101,用 iCircuit 搭了加法器。,-1,陈朝
 9787115249494,8月份研究式阅读书本。Paul优美的语言，精密的逻辑，非常适合练脑和作为写作训练的学习对象。耗时2个月，终于读完了。还是很推荐。,-1,夏一慕
 9787115249494,我想我一定没办法和作者这样的人做朋友，隔着书我似乎都感受到对面一个自信心爆棚甚至自负的人在向我滔滔不绝地灌输他的价值观。书的前三分之一一直在以书呆子的优越感俯瞰终生，后三分之一则在以lisp语言使用者的身份俯瞰众生。中间三分之一关于设计的话题我倒是大部分认可的。书打着非程序员也能看的IT类书籍的旗号，却再一直试图鼓吹创业如何好，lisp如何好，怎么编写自己的编程语言，我承认作者是个成功者，但是仅仅...,-1,酸菜米线
 9787115249494,好几次我一拍大腿，妈的我也是这么想的啊！,-1,fox.psd.不明白
 9787115249494,70％的包装成真理的大言不惭的心灵鸡汤和胡扯＋30％的来自话语权内的有趣的东西。另外关于贝叶斯过滤应用于垃圾邮件的那篇，让人无比想反过滤击败他的过滤系统⋯⋯,-1,TM
 9787115249494,自由思考比畅所欲言更重要,-1,小愉深情款款地
 9787100013239,比较适合我国大二、大三学计算机又有点憧憬人工智能的学生们作课外拓展阅读。主体就三次大过渡：形式逻辑——哥德尔定理——人工智能。由于已经看了《哥德尔证明》和《人工智能哲学》两本，再看这本就觉得作者绕了好大的一圈，最后也没有太多建设性的想法。另外巴赫和埃舍尔虽然一直出场，却并没有达到期待中的深度，大多还是作为辅助解释。“自指”和“配位”是作者强调的两个核心思想。我想随着交叉学科人才的增多，以及AI领域...,-1,亲爱的猥琐猪
 9787100013239,Grand piece.,-1,Ent
 9787100013239,"非常有趣！虽然有一千多页，也不用费太大力气就能读完。比起同时在看的《历史研究》，真是天壤之别。
全书围绕哥德尔不完备定理展开，巧妙的找到了哥德尔、埃舍尔、巴赫三者的共同之处，同时又加入了物理、生物等领域的类比，最后探讨了人工智能。",-1,空气
 9787100013239,艰难看完五章之后决定打五星，然后不再往下看了，放在书架上供起来。,-1,魏知超
 9787100013239,拣自己能读懂的部分浏览了遍，虚荣地标上“已读”，但这些都不影响我真诚地觉得这是一本牛逼的书。是的我第一次用这个词形容一本书！,-1,蓬蓬
 9787115557179,那是一个理想主义大放光芒的时代，我只有羡慕和崇敬。,-1,Squirrel
 9787115557179,不只是历史，还有回忆，所以我拒绝了用《UNIX简史》这个中文书名。《UNIX传奇》这个书名更有温度、更有情感色彩……,-1,旸谷
 9787115557179,一堆大佬的传奇历史。贝尔实验室真的是太伟大了。。。,-1,maxy218
 9787115557179,Unix 操作系统从1969年贝尔实验室诞生以来，发展已经超出创造者的想象。Unix带动了软件的开发，影响了无数的程序员，改变了计算机的发展轨迹。今天整个计算机世界都有Unix和C语言的印记，拜读每个工作者鲜为人知的感人故事，都能深深感受到贝尔实验室发明天才们的有趣往事。每段故事都值得传播和认真学习。,-1,null
 9787115557179,写的很平淡，这也许就是现实吧。印象比较深的是部门编号很有电话号码的编码的感觉。,-1,fuzhli
 9787115546081,合格的入门书，话唠减一分,-1,望断缥缈
 9787115546081,炒鸡好,-1,lemuret
 9787115546081,Python入门的书，讲得特别清晰易懂，弱点在于没讲任何包，没用Jupyter notebook,-1,starrian
 9787115546081,新手学Python非常好的教材，搭配网上一些教学视频效果更佳。,-1,silly
 9787115546081,简洁 易懂 全面 适合新手入门,-1,RioLia
 9787111544937,如果厨二经常说什么神作的话，这本书就是当之无愧的神作,-1,[已注销]
 9787111544937,"这是一本多么神奇的书呢?
无论我怎么看都像是新的",-1,松枝雨果
 9787111544937,"看完会对计算机底层机制有一个overview式的理解,清楚地知道一个""hello world""程序从编写,编译,链接最后实际运行的全过程.作者在开篇提到,""如果你全心投身学习本书中的概念,完全理解底层计算机系统以及它对应用程序的理解,你会步上成为为数不多的大牛之路"".没错,是""步上"",""逐渐成为""大牛.CSAPP是一本很基础的书.糅合了计算机组成原理,操作系统,体系结构,网络编程,并行程序设计原理...",-1,eval
 9787111544937,挺难的。有些地方没有学习的必要，但还是硬着头皮都啃下来了。后期的温故复习的工作量怕是比读书本身的工作量还要大。,-1,苏小蛇
 9787111544937,完结撒花～因为疫情的原因，每天都有大把的时间看书。算了一下，从年后回到上海开始看，到现在已经三个月了。基本上做完了所以习题，看了视频公开课。完成了所有的lab，虽然部分lab完成的质量还可有待提高。合上整本书的时候，真有一种打通任督二脉的欣然自得。这本书无愧于它的名字，提供了一个程序员角度认识计算机的最基本的知识框架。通过这本书为接下来更深入的诸如操作系统、编译原理、计算机组成原理等主干课程的学习...,-1,阿列克斯
 9787115516824,*1 硅谷历史！,-1,hoverius
 9787115516824,太阳底下并无新事,-1,小丸子
 9787115516824,黑客群星闪耀之时,-1,更多的是吃
 9787115516824,这是👴🏻小时候看过的故事，👴🏻读完后励志成为硅谷纵火犯哦我的上帝说错了是硅谷消防员并下令删掉这本书保卫硅谷的安全现在重现人间👴🏻很生气👴🏻一边气一边读完了这本书其实可以和吴军老师的浪潮之巅对比着读浪潮之巅把所有和互联网有关的公司都简述了一遍而这本更偏重和计算机有关的公司主线是盖茨和乔布斯因此也有乔泪军默的传说（原文如此乔布斯说他读完潸然泪下雷军说读完就想试试创办一个类似苹果的公司这就是雷布斯）,-1,iSolomon
 9787115516824,细节相当丰富,-1,skywalker
 9787115441249,"整本书很好的科普了“输入 URL 后发生了什么？”这个问题，沿着包所经过这条线串起了信号、操作系统、Web开发等相关知识，没有去很学究气的掰扯 OSI 七层模型而是大量篇幅用来举例子，来龙去脉讲的平易近人，配图很用心，看得欣欣然有所得；感觉最好看的是中间的部分。想查缺补漏推荐一读 [2017-07-29]
二刷达成，仔细看了TCP会话的生命周期和一些小细节，大概理解了物理层的相关的原理和用户接入 ...",-1,随候鸟南飞
 9787115441249,详略不分,-1,鼎先生
 9787115441249,非常棒的关于网络的科普书，深入浅出，通俗易懂，可惜数据库方面没有这样的书。看完这个再看tcp/ip协议，更加容易理解。,-1,平凡的老鱼
 9787115441249,有趣的科普书，比用来垫显示器的计算机网络书有用多了,-1,Jun
 9787115441249,这本书比大学教材更容易入门，没有复杂的公式，难懂的语言。,-1,闲人小天
 9787115282828,念大学的时候能遇到这样的书就好了。。。,-1,Tony Yet
 9787115282828,"看到各位nlp大佬的事迹，我就像霸王别姬里的小癞子一样：他们怎么成的角儿啊？得挨多少打呀？我什么时候才能成角儿啊？

",-1,mal4
 9787115282828,不错的信息处理数学科普书，其实书中涉及的数学理论远没有作者写的那么简单，只有对这些理论有了深刻的理解或者真正用这些理论在工程实践中漂亮的解决了问题，才能将这些东西用简洁易懂的语言娓娓道来~~,-1,shawcsn
 9787115282828,你们知道我一个数学高考都没有及格的人是怀着怎样的心情看这本书么。。。但是，我居然看完了，而且觉得，真的好有意思。。。,-1,你看起来很美味
 9787115282828,很多有用的算法，可以直接为基础来推动研发了,-1,汪杨
 9787111135104,最喜欢的CS书籍。,-1,黄健宏
 9787111135104,经典不必多说，你所需要做的仅仅是坚持把它读完，并做完其中大部分的习题。,-1,atyuwen
 9787111135104,不得不承认大部分真正让人进步的阅读，读起来都不是愉悦的。,-1,非无衣
 9787111135104,读了前三章，并没有做习题。重点不在函数式编程，而是如书名在程序的构造和解释。函数式编程的优点被现在其他语言吸收的差不多了。话说这本书能看出国内外教育的差距。,-1,wazedix
 9787111135104,"作者寄语：“看懂难，应用更难！咀嚼咀嚼！”
只看正文：“原来如此”，做下习题：“CTMB”。本书风格，就是为展示厨刀的“简单”用法，于是把西瓜雕成了一朵花，然后放头牛出来让你“解一下”。当然啦，作者说了，你修炼成功后，将晋级为膜法师（Computer Wizard），乃至荣升为有小蜜替你工作（can-do-job）的大佬（Big Wheel）。",-1,苍穹之泪
 9787115537973,好像跟第二版差不多……看过第二版的同学不如等第四版吧😂,-1,purate
 9787115537973,一本比较尴尬的书。对于NLP方向人来说，读起来有点太粗浅、要点都没讲透；对于其他方向人来说，估计只能有点感性的认识。,-1,江霰
 9787115537973,名符其实，确实能让人感受到数学之美,-1,急景凋年
 9787115537973,"犹太人在抄《圣经》时会把每个希伯来字母对应一个数字，每行每列都对应一个数，这个数就是校验码。抄完后只要对比每个行列的校验码就可以快速定位抄错部分。

马尔科夫假设让计算机可以处理自然语言，每个词出现的概率只和前一个词有关，涨停之前的往往是股票，那么只要给计算机量足够大的机读文本（语料库），就可以知道一个特定词后面出现的某词概率。然后把一句话里所有词出现的概率相乘，就是这个句子出现的概率。然后把每个...",-1,DuK_MobileSuit
 9787115537973,确实像作者自己说的，能把深奥的科学问题浅显生动解释清楚，这本身就很厉害。可以作为数据科学和机器学习入门书。,-1,星野
 9787115508232,认真看了前两部分虚拟化和并发，持久化简单看了点（不大感兴趣,-1,Jun
 9787115508232,第一本完整读完的 OS 书，挺好读的，断断续续花了小两个月，基本也是按照“发现问题，解决问题”的思路来写，属于 #希望早十年读这本书# 这一类。,-1,kksmq
 9787115508232,IO没看，但是并发和虚拟化讲的非常好，MIT6.828的手册根本不过瘾，看这本解答了好多疑惑！顺便推荐《x86从实模式到保护模式》，配合MIT6.828的实验，简直不要太舒服！,-1,λ
 9787115508232,书是好书。。翻译错误一大堆。,-1,如果可以
 9787115508232,都在说翻译的问题，为何我觉得翻译得不错？整本书读下来很流畅，难得一本把操作系统虚拟化讲得那么清楚的好书，内容比较入门，想要深入还是要去看论文或者通过实践，建议国内大学都用这本书当教材吧。,-1,华莱士谈笑风生
 9787111599715,最好的,-1,柚子 柚子
 9787111599715,花了一周看书，很多没看懂，下次在刷,-1,如果可以
 9787111599715,入门教材,-1,ClowNaxcvd
 9787111599715,我的计算机网络入门书，读起来很流畅易懂，非常好。,-1,*
 9787111599715,看了一个月终于看完了，又补了一次计网知识。,-1,尘与尘
 9787111321330,ICS课大概是我在FDU上过最硬的课,-1,tomsheep
 9787111321330,"12/11 - 13/1
读后功力大增，相见恨晚

能把本质的东西讲的这么易懂，有种读小说的感觉",-1,阳广林
 9787111321330,一周复习完。,-1,二进制赫克斯
 9787111321330,走向高帅富第一步,-1,Josherich
 9787111321330,计算机科学的两本圣经之一，一本十分精彩的书。学完会很累，但也能学到很多有用的东西。,-1,启明君
 9787519821968,名不虚传，分布式系统的基本问题都提到了，而且各种解决方案的优缺点都有。讲的没有那么实用，也没有那么理论，在工业与学术之间平衡的很好。,-1,Cronje
 9787519821968,"断断续续看完了。对于数据架构的整体认识帮助很大，接下来就是到各细分领域继续研究。吐槽一下第十二章的翻译错别字特别多。

我整理的读书笔记：https://www.bicky.me/blog/categories.html#category-Web%20Arch",-1,Swampy
 9787519821968,为了您的身体健康，请不要阅读开源翻译版本....我只举一个例子。leader one翻译成林登万是几个意思？难不成还有林登兔？,-1,张岩kris
 9787519821968,"内容很全面，并且结构非常有条理：提出问题-提出多种解决方案-解决方案的优劣和使用场景。 
前9章翻译水平不错，第10章很差，最后三章建议直接看英文原版。
200111-200212",-1,eminemheaton
 9787519821968,上帝视角细数各类数据相关系统优劣得失，用学术研究的方式来写书，本质上就是一本大综述，真是太适合我了，太棒了。信息量超大，将我平时了解的各种零散概念关联串结起来。又买了一本英文原版的书，本书需放案头常翻，一本不会过时的书,-1,惟以不永怀
 9787121384356,我很佩服云风老师，首先他是一个技艺高超的程序员，其次从他的 twitter 我看见他努力让中文适应 IT 行业的努力。看完这本书我还是觉得很失望，不是说这本书的内容不好。在国内 IT 行业上班的话，会有一种这本书就是「真空中三维球形鸡」一样的感觉。做这行，是写代码让我疲惫吗？不，写代码是这行最轻松的工作。困难的部分在于理解乱七八糟的业务逻辑、复杂多变的网络环境，对了，还有各种需求排期和甩锅。,-1,ଲ ଲ ଲ
 9787121384356,这书太硬了，啃不动。在得到年度推荐书单里看到，就翻了翻。但是，即便啃不动，仍然是挡不住我的喜欢。这里面提供了很多通用的开发或项目思路，例如DRY原则，ETC的部分，之前看到，落地应用很实用。这里面对于客户的认识和其他也让我很喜欢。推荐，懒得啃的话，只是啃一啃目录都会收获良多,-1,艾小玛
 9787121384356,中年程序员也值得一读，读书过程会不自觉的回顾自己的成长经历，很多做事原则原来不是我原创的，而是十几年前在书上读到的建议潜移默化变成了自己的行为指导。,-1,嘉陵
 9787121384356,"这和《程序员修炼之道》一脉相承，来，继续阅读。
不过这个书不好读，比较像百科全书。",-1,毛毛
 9787121384356,"新版本修改了副标题，强调了务实。
面对这个不完美不断变化的世界，我们必须不断地实践、不断地思考、不断地改进，去解决问题。",-1,秋
 9787121022982,真知灼见，可是，其实并不是每个人都用得到，不过那个表驱动法一定要看...事这本书里印象最深的一处,-1,[已注销]
 9787121022982,包罗万象。看完一遍感觉有升级,-1,Chain
 9787121022982,经典软件书籍！,-1,Z
 9787121022982,前两百页是工程学的基础知识、excel其实就是个简便的数据库兼编程工具，在当前计算机运算能力过剩的情况下，这个软件用处非常大，可以简化大多数办公室的程序化劳动，提升你临时解决批量问题的能力。你用excel能随意搭建逻辑链，把两个不同领域的相关问题结合到一起处理的时候-,-1,阅微草堂
 9787121022982,作为程序员，此书必读，先看Kernighan的程序设计实践再看此书效果更佳,-1,figure9
 9787115331809,读完全书我觉得最有意思的是前面鼓语的部分，怎么能这么有趣！！,-1,小油飞
 9787115331809,1、信息的历史：编码、文字、词典、差分机、电报、信号塔、摩斯电码、继电器、电话、分析机、通用计算机、巴贝奇、ada lovelace、万内瓦尔·布什；2、信息的理论：香农、图灵、信息论、信息量、bit、信息熵、比特存储容量、《通信的数学理论》、维纳、控制论、无序vs有序、认知心理学、信息转向、认知革命、再编码、编码理论、熵、克劳修斯、热力学定律、开尔文男爵、宇宙热寂说、H·G·威尔斯、麦克斯韦之妖...,-1,howie.serious
 9787115331809,20160705阅毕。讨论了古代通讯，文字起源（口语到文字过渡期表现为荷马史诗和诸子百家作品），词典，编码和机械，信息论和控制论，统计物理和信息论对熵的相同和不同，gene和meme，编码与信息论、可计算性、冗余、随机性的关系，科学发现的本质相当于找到一种算法，信息/随机性/复杂度三者本质等价性。//这实在是一本介绍和统一物理，生物和信息基本观念的书。也是有跨学科背景看得更过瘾的书。比如10-11...,-1,海若
 9787115331809,这本书重建了我的世界观，它不是简单地拓宽读者的知识广度，而是在其之上增加一个维度。如果说生命的意义在于汲取秩序、消化负熵，那么看完这本书，读者也小小地为这个可爱的世界减少了一点信息熵。,-1,十年之柒
 9787115331809,只是一堆内容的拼凑，没有思考、没有结论。,-1,hauy
 9787535767134,"“我要将混沌放入十四行诗，
……直到他与秩序混合交叠。
日复一日，年复一年，
他傲慢自大，我们卑躬屈膝：
我抓住了他。他只不过是
简单却没有被理解之物。”",-1,drunkdoggy
 9787535767134,1.17 第一推动相见恨晚,-1,绝缘儿
 9787535767134,部分很好，全书系统性不强，私货多。,-1,魏知超
 9787535767134,毫无新意  倒是会炒作  对系统学缺乏了解的人们可能会惊艳一下？  技术上骗骗非数学科班的？老问题，软科普   挺像候世达，不愧他学生   ,-1,[已注销]
 9787535767134,感谢@小宇宙 推荐。 相对一般科普，本书学术味道重一点。文中注释很吸引人，很有价值。涉及了很多领域，有点遗憾是没给我“复杂”的魂，也许是这个领域还是新生的缘故。    相关阅读：失控（这本相对不那么学术），GEB（有几章有关联）。,-1,mathbao
 9787513923927,斯文·贝克特（Sven Beckert）是哈佛大学的美国历史莱尔德·贝尔教授，教授现代资本主义政治经济、美国资本主义历史、镀金时代美国史、劳工历史、全球资本主义课程。贝克特还是哈佛大学资本主义研究项目的联合主席，也是韦瑟黑德全球史计划的联合主席。这部书表面上以棉花为主角，其实是欧洲资本主义的发展史，故事从古典时代棉花的种植和棉纺品的销售为开端，描述了一个由亚洲和美洲共同主导的棉纺贸易的世界。这个世...,-1,苦茶
 9787513923927,这部书竟然如此贴近当下中国的思想和舆论场域，这大概“得益”于中学教育赋予中国读者对马列政治经济学模板的熟悉。短评篇幅有限，略陈两点：1、本书并非以棉花为案例来展现资本主义历史，而是将棉花如何成为资本主义核心要素作为现代世界的起源。因此，所谓现代世界就是资本主义世界。从作者描述的“资本-商品-民族国家”的框架引申：今日世界其实并无什么社什么资，只有资本主义的不同阶段。2、中国读者的熟悉感，不仅来自于...,-1,danyboy
 9787513923927,详实，缺乏新知。严密，没有联想。相比之下，我还是更喜欢@顾有容 那样的解读方式，一个熟悉的物件做主题，串联历史文化政治和科学。只关注自然，不接地气，只关注人文，又太土太虚。结合起来很舒服，因为文理本就不该分科。「分科是人类大脑对过于丰富的知识的妥协」,-1,null
 9787513923927,"通篇看完才知道为何以棉花为资本主义全球史的主角，而不是可可、咖啡、石油或者铁矿石。凝结在棉花上的财富和血泪正是近三四百年人类历史诸多重要事件的写照：航海大发现、奴隶制、小农经济与资本主义萌芽、工业革命、美国内战与全球废奴运动、殖民统治与海外代理、经济全球化、第三世界崛起等等。

人类从诞生起，血液中就带上了资本主义的基因，追求效益最优和利润最大化只是摆得上台面的说辞，背地里的掠夺、剥削不会消失，只...",-1,Dichtung
 9787513923927,失败的全球史写作，博而不精，无甚高论，马克思波兰尼沃勒斯坦的中心与边缘，资本主义前史和扩张，Tilly的战争国家，时髦的重新发现东方。文笔一般，篇幅也过于冗长,-1,木其水
 9787508638492,这个话题太复杂了，我看着觉得作者也没找到本质。,-1,毅哥
 9787508638492,他们懒惰而上进、高尚而鬼祟、愤怒而顺从、无助而自强。他们缺乏信息导致无法做出正确决策，朝不保夕因而放弃投资及时行乐，出身卑微只能自怨自艾自生自灭。一辈子逃离不出的「贫穷陷阱」。光读起来都感到绝望。,-1,XDash
